{
 "authority": {
  "can_decide": false,
  "note": "Step C static mana evidence only; no land or mana-source swap is decided by this record."
 },
 "canonical_hash": "lh1:627cae661f5af180a2ecc851b83da60339952c4d78cee92e97c0c0bd4eba0132",
 "colored_sources": {
  "conditional_land_sources": {
   "B": 1,
   "R": 2,
   "U": 2
  },
  "land_plus_repeatable_nonland": {
   "B": 25,
   "R": 27,
   "U": 29
  },
  "land_sources": {
   "B": 18,
   "R": 20,
   "U": 22
  },
  "unconditional_land_sources": {
   "B": 17,
   "R": 18,
   "U": 20
  },
  "untapped_or_conditionally_untapped_land_sources": {
   "B": 16,
   "R": 19,
   "U": 20
  }
 },
 "commander_casting": [
  {
   "all_required_colors_present_by_base_turn": 0.772115,
   "base_resource_target": 3,
   "colored_requirements": {
    "B": 1,
    "R": 1,
    "U": 1
   },
   "first_recast_resource_target": 5,
   "mana_cost": "{U}{B}{R}",
   "mana_value": 3.0,
   "name": "Anhelo, the Painter",
   "per_color_source_presence_by_base_turn": {
    "B": 0.87943,
    "R": 0.907526,
    "U": 0.929586
   },
   "second_recast_resource_target": 7
  }
 ],
 "confidence": "moderate",
 "counts": {
  "conditional_mana_lands": 2,
  "conditional_tapped_lands": 10,
  "fast_mana": 10,
  "fetchlands": 3,
  "flex_land_mdfcs": 1,
  "lands": 34,
  "library_cards": 99,
  "one_shot_mana": 0,
  "repeatable_nonland_sources": 10,
  "rituals": 1,
  "unconditional_tapped_lands": 2,
  "utility_lands": 1
 },
 "deck_color_identity": "UBR",
 "deck_id": "Anhelo__the_Painter",
 "evidence_class": "derived_metric",
 "fast_mana_cards": [
  "Arcane Signet",
  "Dark Ritual",
  "Dimir Signet",
  "Fellwar Stone",
  "Izzet Signet",
  "Rakdos Signet",
  "Sol Ring",
  "Talisman of Creativity",
  "Talisman of Dominance",
  "Talisman of Indulgence"
 ],
 "inputs": {
  "canonical_export": "exports/grixis-archidekt/anhelo-the-painter.txt",
  "card_index": "data/card_index.csv",
  "card_shards": "cards/** (frozen generated Oracle pages)"
 },
 "land_type_coverage": {
  "basic_counts": {
   "Forest": 0,
   "Island": 3,
   "Mountain": 3,
   "Plains": 0,
   "Swamp": 3
  },
  "fetches": [
   {
    "basic_fetch": false,
    "card": "Bloodstained Mire",
    "potential_source_colors": "BR",
    "types": [
     "Swamp",
     "Mountain"
    ]
   },
   {
    "basic_fetch": false,
    "card": "Polluted Delta",
    "potential_source_colors": "UB",
    "types": [
     "Island",
     "Swamp"
    ]
   },
   {
    "basic_fetch": false,
    "card": "Scalding Tarn",
    "potential_source_colors": "UR",
    "types": [
     "Island",
     "Mountain"
    ]
   }
  ],
  "typed_land_counts": {
   "Forest": 0,
   "Island": 9,
   "Mountain": 8,
   "Plains": 0,
   "Swamp": 9
  }
 },
 "limitations": [
  "Source-access probabilities are no-mulligan draw/presence proxies, not cast probabilities.",
  "Conditional/filter/opponent-dependent sources are labeled but not assigned a real-game reliability percentage.",
  "Fetch colors are potential colors from Oracle/basic-land-type wording; target availability is summarized by typed-land coverage and refined in later Step C batches.",
  "Tapped-source timing is counted, not yet simulated jointly with spell sequencing.",
  "Fast mana and rituals are inventoried; commander-tax recovery and startup sequencing are refined later in Step C."
 ],
 "mdfc_cards": [
  "Primal Amulet // Primal Wellspring"
 ],
 "one_shot_mana_cards": [],
 "pip_demand": {
  "colored_spell_count": 53,
  "double_pip_spell_count": {
   "B": 3,
   "R": 4,
   "U": 7
  },
  "mv_le_2": {
   "B": 10.0,
   "R": 6.0,
   "U": 16.0
  },
  "mv_le_3": {
   "B": 15.0,
   "R": 18.0,
   "U": 22.0
  },
  "raw_colored_pip_equivalents": {
   "B": 22.0,
   "R": 27.0,
   "U": 35.0
  },
  "share": {
   "B": 0.2619,
   "R": 0.3214,
   "U": 0.4167
  }
 },
 "ritual_cards": [
  "Dark Ritual"
 ],
 "schema_version": 1,
 "slug": "anhelo-the-painter",
 "status": "provisional_evidence",
 "turn_access_proxies": {
  "2": {
   "all_three_land_source_presence": 0.718862,
   "cards_seen_no_mulligan": 9,
   "flex_land_drop_probability": 0.894597,
   "per_color_at_least_one_land_source": {
    "B": 0.849288,
    "R": 0.881105,
    "U": 0.906806
   },
   "strict_land_drop_probability": 0.882395
  },
  "3": {
   "all_three_land_source_presence": 0.772115,
   "cards_seen_no_mulligan": 10,
   "flex_land_drop_probability": 0.759362,
   "per_color_at_least_one_land_source": {
    "B": 0.87943,
    "R": 0.907526,
    "U": 0.929586
   },
   "strict_land_drop_probability": 0.736993
  },
  "4": {
   "all_three_land_source_presence": 0.816697,
   "cards_seen_no_mulligan": 11,
   "flex_land_drop_probability": 0.592219,
   "per_color_at_least_one_land_source": {
    "B": 0.903815,
    "R": 0.928307,
    "U": 0.946992
   },
   "strict_land_drop_probability": 0.562728
  },
  "5": {
   "all_three_land_source_presence": 0.85359,
   "cards_seen_no_mulligan": 12,
   "flex_land_drop_probability": 0.425075,
   "per_color_at_least_one_land_source": {
    "B": 0.923489,
    "R": 0.944601,
    "U": 0.960244
   },
   "strict_land_drop_probability": 0.393908
  }
 },
 "unresolved_cards": [],
 "utility_opportunity_cost": {
  "colorless_only_utility_lands": [],
  "tapped_utility_lands": [],
  "utility_lands": [
   "Otawara, Soaring City"
  ]
 }
}
