{
 "authority": {
  "can_decide": false,
  "note": "Step C static mana evidence only; no land or mana-source swap is decided by this record."
 },
 "canonical_hash": "lh1:f4342af184fe4a9ebee2c9ccb6b8a4fac7d9bc98866a6bc258965fffa589c300",
 "colored_sources": {
  "conditional_land_sources": {
   "B": 1,
   "R": 1,
   "U": 1
  },
  "land_plus_repeatable_nonland": {
   "B": 23,
   "R": 23,
   "U": 25
  },
  "land_sources": {
   "B": 18,
   "R": 18,
   "U": 19
  },
  "unconditional_land_sources": {
   "B": 17,
   "R": 17,
   "U": 18
  },
  "untapped_or_conditionally_untapped_land_sources": {
   "B": 17,
   "R": 17,
   "U": 18
  }
 },
 "commander_casting": [
  {
   "all_required_colors_present_by_base_turn": 0.78059,
   "base_resource_target": 4,
   "colored_requirements": {
    "B": 1,
    "R": 1,
    "U": 1
   },
   "first_recast_resource_target": 6,
   "mana_cost": "{1}{U}{B}{R}",
   "mana_value": 4.0,
   "name": "Zevlor, Elturel Exile",
   "per_color_source_presence_by_base_turn": {
    "B": 0.903815,
    "R": 0.903815,
    "U": 0.916877
   },
   "second_recast_resource_target": 8
  }
 ],
 "confidence": "moderate",
 "counts": {
  "conditional_mana_lands": 1,
  "conditional_tapped_lands": 6,
  "fast_mana": 5,
  "fetchlands": 9,
  "flex_land_mdfcs": 0,
  "lands": 34,
  "library_cards": 99,
  "one_shot_mana": 2,
  "repeatable_nonland_sources": 8,
  "rituals": 1,
  "unconditional_tapped_lands": 1,
  "utility_lands": 5
 },
 "deck_color_identity": "UBR",
 "deck_id": "Zevlor__Elturel_Exile",
 "evidence_class": "derived_metric",
 "fast_mana_cards": [
  "Arcane Signet",
  "Dark Ritual",
  "Mana Vault",
  "Omen Hawker",
  "Sol Ring"
 ],
 "inputs": {
  "canonical_export": "exports/grixis-archidekt/zevlor-elturel-exile.txt",
  "card_index": "data/card_index.csv",
  "card_shards": "cards/** (frozen generated Oracle pages)"
 },
 "land_type_coverage": {
  "basic_counts": {
   "Forest": 0,
   "Island": 2,
   "Mountain": 2,
   "Plains": 0,
   "Swamp": 2
  },
  "fetches": [
   {
    "basic_fetch": false,
    "card": "Arid Mesa",
    "potential_source_colors": "WR",
    "types": [
     "Plains",
     "Mountain"
    ]
   },
   {
    "basic_fetch": false,
    "card": "Bloodstained Mire",
    "potential_source_colors": "BR",
    "types": [
     "Swamp",
     "Mountain"
    ]
   },
   {
    "basic_fetch": false,
    "card": "Flooded Strand",
    "potential_source_colors": "WU",
    "types": [
     "Plains",
     "Island"
    ]
   },
   {
    "basic_fetch": false,
    "card": "Marsh Flats",
    "potential_source_colors": "WB",
    "types": [
     "Plains",
     "Swamp"
    ]
   },
   {
    "basic_fetch": false,
    "card": "Misty Rainforest",
    "potential_source_colors": "UG",
    "types": [
     "Island",
     "Forest"
    ]
   },
   {
    "basic_fetch": false,
    "card": "Polluted Delta",
    "potential_source_colors": "UB",
    "types": [
     "Island",
     "Swamp"
    ]
   },
   {
    "basic_fetch": false,
    "card": "Scalding Tarn",
    "potential_source_colors": "UR",
    "types": [
     "Island",
     "Mountain"
    ]
   },
   {
    "basic_fetch": false,
    "card": "Verdant Catacombs",
    "potential_source_colors": "BG",
    "types": [
     "Swamp",
     "Forest"
    ]
   },
   {
    "basic_fetch": false,
    "card": "Wooded Foothills",
    "potential_source_colors": "RG",
    "types": [
     "Mountain",
     "Forest"
    ]
   }
  ],
  "typed_land_counts": {
   "Forest": 0,
   "Island": 7,
   "Mountain": 7,
   "Plains": 0,
   "Swamp": 7
  }
 },
 "limitations": [
  "Source-access probabilities are no-mulligan draw/presence proxies, not cast probabilities.",
  "Conditional/filter/opponent-dependent sources are labeled but not assigned a real-game reliability percentage.",
  "Fetch colors are potential colors from Oracle/basic-land-type wording; target availability is summarized by typed-land coverage and refined in later Step C batches.",
  "Tapped-source timing is counted, not yet simulated jointly with spell sequencing.",
  "Fast mana and rituals are inventoried; commander-tax recovery and startup sequencing are refined later in Step C."
 ],
 "mdfc_cards": [],
 "one_shot_mana_cards": [
  "Flick a Coin",
  "Storm-Kiln Artist"
 ],
 "pip_demand": {
  "colored_spell_count": 57,
  "double_pip_spell_count": {
   "B": 3,
   "R": 2,
   "U": 11
  },
  "mv_le_2": {
   "B": 8.0,
   "R": 9.0,
   "U": 21.0
  },
  "mv_le_3": {
   "B": 14.0,
   "R": 14.0,
   "U": 28.0
  },
  "raw_colored_pip_equivalents": {
   "B": 23.0,
   "R": 21.0,
   "U": 45.0
  },
  "share": {
   "B": 0.2584,
   "R": 0.236,
   "U": 0.5056
  }
 },
 "ritual_cards": [
  "Dark Ritual"
 ],
 "schema_version": 1,
 "slug": "zevlor-elturel-exile",
 "status": "provisional_evidence",
 "turn_access_proxies": {
  "2": {
   "all_three_land_source_presence": 0.678441,
   "cards_seen_no_mulligan": 9,
   "flex_land_drop_probability": 0.882395,
   "per_color_at_least_one_land_source": {
    "B": 0.849288,
    "R": 0.849288,
    "U": 0.866033
   },
   "strict_land_drop_probability": 0.882395
  },
  "3": {
   "all_three_land_source_presence": 0.733327,
   "cards_seen_no_mulligan": 10,
   "flex_land_drop_probability": 0.736993,
   "per_color_at_least_one_land_source": {
    "B": 0.87943,
    "R": 0.87943,
    "U": 0.894315
   },
   "strict_land_drop_probability": 0.736993
  },
  "4": {
   "all_three_land_source_presence": 0.78059,
   "cards_seen_no_mulligan": 11,
   "flex_land_drop_probability": 0.562728,
   "per_color_at_least_one_land_source": {
    "B": 0.903815,
    "R": 0.903815,
    "U": 0.916877
   },
   "strict_land_drop_probability": 0.562728
  },
  "5": {
   "all_three_land_source_presence": 0.820798,
   "cards_seen_no_mulligan": 12,
   "flex_land_drop_probability": 0.393908,
   "per_color_at_least_one_land_source": {
    "B": 0.923489,
    "R": 0.923489,
    "U": 0.934824
   },
   "strict_land_drop_probability": 0.393908
  }
 },
 "unresolved_cards": [],
 "utility_opportunity_cost": {
  "colorless_only_utility_lands": [],
  "tapped_utility_lands": [
   "Xander's Lounge"
  ],
  "utility_lands": [
   "Minamo, School at Water's Edge",
   "Otawara, Soaring City",
   "Sokenzan, Crucible of Defiance",
   "Takenuma, Abandoned Mire",
   "Xander's Lounge"
  ]
 }
}
