{
 "authority": {
  "can_decide": false,
  "note": "Step C static mana evidence only; no land or mana-source swap is decided by this record."
 },
 "canonical_hash": "lh1:ef9b2bd79878dfd9159c9c04cb9c6aa79f02b5e42f723a9fa905dd219d29a39d",
 "colored_sources": {
  "conditional_land_sources": {
   "B": 2,
   "R": 2,
   "U": 2
  },
  "land_plus_repeatable_nonland": {
   "B": 23,
   "R": 23,
   "U": 24
  },
  "land_sources": {
   "B": 18,
   "R": 18,
   "U": 19
  },
  "unconditional_land_sources": {
   "B": 16,
   "R": 16,
   "U": 17
  },
  "untapped_or_conditionally_untapped_land_sources": {
   "B": 17,
   "R": 17,
   "U": 18
  }
 },
 "commander_casting": [
  {
   "all_required_colors_present_by_base_turn": 0.790477,
   "base_resource_target": 4,
   "colored_requirements": {
    "B": 1,
    "R": 1,
    "U": 1
   },
   "first_recast_resource_target": 6,
   "mana_cost": "{1}{U}{B}{R}",
   "mana_value": 4.0,
   "name": "Davros, Dalek Creator",
   "per_color_source_presence_by_base_turn": {
    "B": 0.903815,
    "R": 0.903815,
    "U": 0.916877
   },
   "second_recast_resource_target": 8
  }
 ],
 "confidence": "moderate",
 "counts": {
  "conditional_mana_lands": 2,
  "conditional_tapped_lands": 6,
  "fast_mana": 7,
  "fetchlands": 5,
  "flex_land_mdfcs": 0,
  "lands": 34,
  "library_cards": 99,
  "one_shot_mana": 0,
  "repeatable_nonland_sources": 7,
  "rituals": 0,
  "unconditional_tapped_lands": 1,
  "utility_lands": 4
 },
 "deck_color_identity": "UBR",
 "deck_id": "Davros__Dalek_Creator",
 "evidence_class": "derived_metric",
 "fast_mana_cards": [
  "Arcane Signet",
  "Fellwar Stone",
  "Mox Opal",
  "Sol Ring",
  "Talisman of Creativity",
  "Talisman of Dominance",
  "Talisman of Indulgence"
 ],
 "inputs": {
  "canonical_export": "exports/grixis-archidekt/davros-dalek-creator.txt",
  "card_index": "data/card_index.csv",
  "card_shards": "cards/** (frozen generated Oracle pages)"
 },
 "land_type_coverage": {
  "basic_counts": {
   "Forest": 0,
   "Island": 2,
   "Mountain": 3,
   "Plains": 0,
   "Swamp": 3
  },
  "fetches": [
   {
    "basic_fetch": false,
    "card": "Bloodstained Mire",
    "potential_source_colors": "BR",
    "types": [
     "Swamp",
     "Mountain"
    ]
   },
   {
    "basic_fetch": false,
    "card": "Marsh Flats",
    "potential_source_colors": "B",
    "types": [
     "Plains",
     "Swamp"
    ]
   },
   {
    "basic_fetch": false,
    "card": "Misty Rainforest",
    "potential_source_colors": "U",
    "types": [
     "Island",
     "Forest"
    ]
   },
   {
    "basic_fetch": false,
    "card": "Polluted Delta",
    "potential_source_colors": "UB",
    "types": [
     "Island",
     "Swamp"
    ]
   },
   {
    "basic_fetch": false,
    "card": "Scalding Tarn",
    "potential_source_colors": "UR",
    "types": [
     "Island",
     "Mountain"
    ]
   }
  ],
  "typed_land_counts": {
   "Forest": 0,
   "Island": 7,
   "Mountain": 8,
   "Plains": 0,
   "Swamp": 8
  }
 },
 "limitations": [
  "Source-access probabilities are no-mulligan draw/presence proxies, not cast probabilities.",
  "Conditional/filter/opponent-dependent sources are labeled but not assigned a real-game reliability percentage.",
  "Fetch colors are potential colors from Oracle/basic-land-type wording; target availability is summarized by typed-land coverage and refined in later Step C batches.",
  "Tapped-source timing is counted, not yet simulated jointly with spell sequencing.",
  "Fast mana and rituals are inventoried; commander-tax recovery and startup sequencing are refined later in Step C."
 ],
 "mdfc_cards": [],
 "one_shot_mana_cards": [],
 "pip_demand": {
  "colored_spell_count": 51,
  "double_pip_spell_count": {
   "B": 6,
   "R": 2,
   "U": 5
  },
  "mv_le_2": {
   "B": 12.0,
   "R": 6.0,
   "U": 11.0
  },
  "mv_le_3": {
   "B": 20.0,
   "R": 10.0,
   "U": 16.0
  },
  "raw_colored_pip_equivalents": {
   "B": 42.0,
   "R": 19.0,
   "U": 24.0
  },
  "share": {
   "B": 0.4941,
   "R": 0.2235,
   "U": 0.2824
  }
 },
 "ritual_cards": [],
 "schema_version": 1,
 "slug": "davros-dalek-creator",
 "status": "provisional_evidence",
 "turn_access_proxies": {
  "2": {
   "all_three_land_source_presence": 0.693205,
   "cards_seen_no_mulligan": 9,
   "flex_land_drop_probability": 0.882395,
   "per_color_at_least_one_land_source": {
    "B": 0.849288,
    "R": 0.849288,
    "U": 0.866033
   },
   "strict_land_drop_probability": 0.882395
  },
  "3": {
   "all_three_land_source_presence": 0.745531,
   "cards_seen_no_mulligan": 10,
   "flex_land_drop_probability": 0.736993,
   "per_color_at_least_one_land_source": {
    "B": 0.87943,
    "R": 0.87943,
    "U": 0.894315
   },
   "strict_land_drop_probability": 0.736993
  },
  "4": {
   "all_three_land_source_presence": 0.790477,
   "cards_seen_no_mulligan": 11,
   "flex_land_drop_probability": 0.562728,
   "per_color_at_least_one_land_source": {
    "B": 0.903815,
    "R": 0.903815,
    "U": 0.916877
   },
   "strict_land_drop_probability": 0.562728
  },
  "5": {
   "all_three_land_source_presence": 0.828666,
   "cards_seen_no_mulligan": 12,
   "flex_land_drop_probability": 0.393908,
   "per_color_at_least_one_land_source": {
    "B": 0.923489,
    "R": 0.923489,
    "U": 0.934824
   },
   "strict_land_drop_probability": 0.393908
  }
 },
 "unresolved_cards": [],
 "utility_opportunity_cost": {
  "colorless_only_utility_lands": [
   "Geier Reach Sanitarium"
  ],
  "tapped_utility_lands": [],
  "utility_lands": [
   "Fiery Islet",
   "Geier Reach Sanitarium",
   "Otawara, Soaring City",
   "Plaza of Heroes"
  ]
 }
}
